{
  "id": "APP-06",
  "name": "Game-Like Website",
  "summary": "A bounded interactive module: one mechanic, keyboard and touch controls, progress state, optional sound and a skip control. Only when the client confirms at B1 that play is the point.",
  "registryVersion": "0.1.0",
  "verification": "implemented",
  "module": {
    "skill": "skills/app06/SKILL.md",
    "recipes": [
      "skills/app06/recipes/sections/Game.astro",
      "skills/app06/recipes/lib/game.js"
    ]
  },
  "selectWhen": {
    "field": "features.interactive",
    "op": "includes",
    "value": "game"
  },
  "rejectWhen": {
    "field": "features.playIsThePoint",
    "op": "neq",
    "value": true
  },
  "requiresApproval": [
    "B1"
  ],
  "fallback": {
    "approach": "APP-01",
    "description": "An interactive explainer section with the same content",
    "triggers": [
      "no-webgl",
      "low-end-device",
      "load-failed",
      "slow-network"
    ]
  },
  "budget": {
    "extraJsKbGzip": 400,
    "minFps": 30,
    "loadAfterLcp": true
  },
  "dependencies": [
    {
      "name": "phaser",
      "licence": "MIT",
      "licenceVerified": true,
      "note": "MIT as listed on npm (2026-10-28). Pinned at 4.2.1 by the APP-06 module."
    },
    {
      "name": "physics library",
      "licence": "none needed",
      "licenceVerified": true,
      "note": "The APP-06 mechanic needs only distance checks, done with Phaser's own maths; no physics library is shipped."
    },
    {
      "name": "audio",
      "licence": "per file",
      "licenceVerified": false,
      "note": "The APP-06 module synthesises its sounds with Web Audio and ships no audio files. Any audio file added later needs a licence record."
    }
  ],
  "tests": {
    "positiveBriefs": [
      "tests/decision/app06/pos-1.json",
      "tests/decision/app06/pos-2.json",
      "tests/decision/app06/pos-3.json"
    ],
    "negativeBriefs": [
      "tests/decision/app06/neg-1.json",
      "tests/decision/app06/neg-2.json",
      "tests/decision/app06/neg-3.json"
    ],
    "build": "tests/build/app06.test.mjs",
    "fallback": "tests/build/app06.test.mjs",
    "budget": "tests/build/app06.test.mjs"
  }
}
